{"code_commit":"8075ef2edba0119c57901b3a880cb6e7989eb8f1","cohort_metrics":[{"metrics":{"abstention_count":0,"coverage":1.0,"global_baseline_count":1,"global_baseline_large_error_rate":null,"global_baseline_mae":0.13999999999999996,"large_error_rate":null,"large_error_threshold":null,"mae":0.10626881561156326,"predicted_count":1,"predicted_days":1,"site_baseline_count":1,"site_baseline_mae":0.040000000000000036,"test_count":1},"observer_id":"bunaken-observer-01","rubric_version":"pci-overall-v1"}],"date_wita":"2026-10-15","excluded_observations":[],"generated_at":"2026-10-15T04:54:13Z","input_sha256":"c53d6ff320de5b6b7a867bea05000a4e02d7b968d298fa77bb92d6599b35b331","limitations":["stored_60m_slot_vs_actual_dive_interval","approximate_temporal_match","pci_is_subjective_not_velocity_or_safety","nulls_are_abstentions","no_recalculation_of_stored_forecast"],"official_snapshot":{"cutoff_at":"2026-10-14T12:00:00Z","forecast_sha256":"2bfbda519b841dab4863733d47bf9541b5e19ccab4a78d96a28a8de8894c9038","manifest_sha256":"bc0c056b5528df4913761ba472a716cf2c0cb063791fee6d1c1e531895a941cd","persisted_at":"2026-10-13T19:06:15Z","run_id":"170b674d-8985-5a4d-b962-69455dfc5b89","seal_sha256":"48155d4eb7b6429dfa6d99fd7da33625783c8bbf3f891755dbf1e926ec4f24ee","storage_commit":"bea9187f5d309cd350040a31d203305228bd31c2"},"rows":[{"absolute_error":0.10626881561156326,"actual":0.42,"day":"2026-10-15","global_baseline":0.28,"id":"768eaa7e-cb36-4363-b9b3-5f7ab55e015d","midpoint_offset_minutes":14.0,"model_version":"weighted-analog-v1.3","observation_end_at":"2026-10-15T02:41:00.000Z","observation_sha256":"9cbffb12054d1a0bdfb609ea97728e00ef24b45687a747ac45a54fa4640b9080","observation_start_at":"2026-10-15T01:51:00.000Z","pci":0.3137311843884367,"prediction_duration_minutes":60,"prediction_start_at":"2026-10-15T02:00:00+00:00","reason_codes":[],"revision":1,"site_baseline":0.46,"site_id":"mandolin","support":"very_low","temporal_match":"approximate_window","zone_id":null}],"rule":"stored-slot-midpoint-15m-v1","schema_version":"1.0","source_data_commit":"90aad7334a6f40858fe8a1b85860cf866fd59e3d"}
