{"code_commit":"c84cb9a99036be44b36a0bc73417cb119371bedc","cohort_metrics":[{"metrics":{"abstention_count":3,"coverage":0.0,"global_baseline_large_error_rate":null,"global_baseline_mae":null,"large_error_rate":null,"large_error_threshold":null,"mae":null,"predicted_count":0,"predicted_days":0,"site_baseline_mae":null,"test_count":3},"observer_id":"bunaken-observer-01","rubric_version":"pci-overall-v1"}],"date_wita":"2026-10-08","excluded_observations":[],"generated_at":"2026-10-08T18:48:06Z","input_sha256":"ffa9e8a06711c89724268ebff6e167a48a3feaa6f8dba3cc71aed6f1d895ed93","limitations":["stored_60m_slot_vs_actual_dive_interval","approximate_temporal_match","pci_is_subjective_not_velocity_or_safety","nulls_are_abstentions","no_recalculation_of_stored_forecast"],"official_snapshot":{"cutoff_at":"2026-10-07T12:00:00Z","forecast_sha256":"ff408d08d7b72d9d3a20724e11bfe0d4da81d010be6c133e26ad1d2c12315408","manifest_sha256":"7df692548ff28751d4143286310d543373a6f8037b82e9dfca34c3c8bfe336e8","persisted_at":"2026-10-07T09:54:58Z","run_id":"a1e67d63-8470-56d4-8642-ac054663c69b","seal_sha256":"334b575f6f52882449c2ccf84c7aed658ba0a9688b86d59737846fd777145158","storage_commit":"74f3d864636adeca0d317f0502deb623421a2dd8"},"rows":[{"absolute_error":null,"actual":0.27,"day":"2026-10-08","global_baseline":null,"id":"07ba1d71-c313-42c4-971f-04f8fb2e7160","midpoint_offset_minutes":1.0,"model_version":"weighted-analog-v1.3","observation_end_at":"2026-10-08T04:24:00.000Z","observation_sha256":"0656c45bc46ed8075f8d649295ab4fc37fab4bd464fe4d20003038787866ed77","observation_start_at":"2026-10-08T03:34:00.000Z","pci":null,"prediction_duration_minutes":60,"prediction_start_at":"2026-10-08T03:30:00+00:00","reason_codes":["missing_required_features","insufficient_feature_coverage","insufficient_numeric_labels","insufficient_analogs","insufficient_distinct_days","insufficient_effective_size","missing_same_site"],"revision":1,"site_baseline":null,"site_id":"pahepa","support":"insufficient","temporal_match":"approximate_window","zone_id":null},{"absolute_error":null,"actual":0.28,"day":"2026-10-08","global_baseline":null,"id":"73a69f15-6575-454e-8c05-6a8adff06f3c","midpoint_offset_minutes":4.0,"model_version":"weighted-analog-v1.3","observation_end_at":"2026-10-08T06:29:00.000Z","observation_sha256":"e5dbb0f841985c490ad2039150d3f8af5ebb83fe4e012b5502138f8dd7cbf8ab","observation_start_at":"2026-10-08T05:39:00.000Z","pci":null,"prediction_duration_minutes":60,"prediction_start_at":"2026-10-08T05:30:00+00:00","reason_codes":["missing_required_features","insufficient_feature_coverage","insufficient_numeric_labels","insufficient_analogs","insufficient_distinct_days","insufficient_effective_size","missing_same_site"],"revision":1,"site_baseline":null,"site_id":"bunaken-timur-2","support":"insufficient","temporal_match":"approximate_window","zone_id":null},{"absolute_error":null,"actual":0.28,"day":"2026-10-08","global_baseline":null,"id":"e23d4502-d788-4b01-9444-1e091852bcf2","midpoint_offset_minutes":10.0,"model_version":"weighted-analog-v1.3","observation_end_at":"2026-10-08T02:37:00.000Z","observation_sha256":"0ff89a2a2ac9060e94e148ab0934bd7c19c7ec1936619aa795101a4ed905c2e6","observation_start_at":"2026-10-08T01:43:00.000Z","pci":null,"prediction_duration_minutes":60,"prediction_start_at":"2026-10-08T01:30:00+00:00","reason_codes":["missing_required_features","insufficient_feature_coverage","insufficient_numeric_labels","insufficient_analogs","insufficient_distinct_days","insufficient_effective_size","missing_same_site"],"revision":1,"site_baseline":null,"site_id":"sachikos-point","support":"insufficient","temporal_match":"approximate_window","zone_id":null}],"rule":"stored-slot-midpoint-15m-v1","schema_version":"1.0","source_data_commit":"8707b4cbadf94fc9b13f80eba8997574ac8289c0"}
