{"code_commit":"5653fe2ec05a06f1ef2d3f45e22ef05dfc5978ca","cohort_metrics":[{"metrics":{"abstention_count":1,"coverage":0.5,"global_baseline_count":1,"global_baseline_large_error_rate":null,"global_baseline_mae":0.015000000000000013,"large_error_rate":null,"large_error_threshold":null,"mae":0.03361246784850869,"predicted_count":1,"predicted_days":1,"site_baseline_count":1,"site_baseline_mae":0.015000000000000013,"test_count":2},"observer_id":"bunaken-observer-01","rubric_version":"pci-overall-v1"}],"date_wita":"2026-10-22","excluded_observations":[],"generated_at":"2026-10-22T20:18:58Z","input_sha256":"e45da1a16f8e5751f88b829ab4160a120164f5d91586ae80d4f113fb28ba9626","limitations":["stored_60m_slot_vs_actual_dive_interval","approximate_temporal_match","pci_is_subjective_not_velocity_or_safety","nulls_are_abstentions","no_recalculation_of_stored_forecast"],"official_snapshot":{"cutoff_at":"2026-10-21T12:00:00Z","forecast_sha256":"410f867dd5c58e0d48ae793cf8b41770cdbf920670b5effaee0d9a19b93b1fc7","manifest_sha256":"7251a9a6db765c8eeb63fd7bb104e12bf4d42aab46fc2380226a96119a2325cd","persisted_at":"2026-10-21T11:05:16Z","run_id":"c8ec55e5-e020-55fd-8f23-11f61ed0cc5a","seal_sha256":"baf1de380b45484466fcaf416e741a3d3a88d96e8bc0fc06340cf8711d206df4","storage_commit":"00f784511e3b522d62705e600ff4593bc8756336"},"rows":[{"absolute_error":0.03361246784850869,"actual":0.27,"day":"2026-10-22","global_baseline":0.28500000000000003,"id":"ed294b04-045c-4d65-af7e-22cd5cff7b0e","midpoint_offset_minutes":9.5,"model_version":"weighted-analog-v1.3","observation_end_at":"2026-10-22T06:06:00.000Z","observation_sha256":"50ba241186c3346aad554e20fc6f161c1c7dd62f88cfe57442f736cbeaf96e55","observation_start_at":"2026-10-22T05:13:00.000Z","pci":0.3036124678485087,"prediction_duration_minutes":60,"prediction_start_at":"2026-10-22T05:00:00+00:00","reason_codes":[],"revision":1,"site_baseline":0.255,"site_id":"celah-celah","support":"very_low","temporal_match":"approximate_window","zone_id":null},{"absolute_error":null,"actual":0.3,"day":"2026-10-22","global_baseline":0.28500000000000003,"id":"efe42dc5-76b8-474d-b1f2-400e14fdf1e9","midpoint_offset_minutes":5.0,"model_version":"weighted-analog-v1.3","observation_end_at":"2026-10-22T04:00:00.000Z","observation_sha256":"1b116b990c655501f1c5274c05154fa092ff787e109f74869e6f3bcc7f888e92","observation_start_at":"2026-10-22T03:10:00.000Z","pci":null,"prediction_duration_minutes":60,"prediction_start_at":"2026-10-22T03:00:00+00:00","reason_codes":["missing_same_site"],"revision":1,"site_baseline":0.44,"site_id":"mandolin","support":"insufficient","temporal_match":"approximate_window","zone_id":null}],"rule":"stored-slot-midpoint-15m-v1","schema_version":"1.0","source_data_commit":"c13ce6a1728106371d460f77e1b392f5c3cb00fd"}
