{"code_commit":"c84cb9a99036be44b36a0bc73417cb119371bedc","cohort_metrics":[{"metrics":{"abstention_count":0,"coverage":1.0,"global_baseline_count":3,"global_baseline_large_error_rate":null,"global_baseline_mae":0.013333333333333327,"large_error_rate":null,"large_error_threshold":null,"mae":0.01294978801335315,"predicted_count":3,"predicted_days":1,"site_baseline_count":3,"site_baseline_mae":0.04500000000000002,"test_count":3},"observer_id":"bunaken-observer-01","rubric_version":"pci-overall-v1"}],"date_wita":"2026-10-09","excluded_observations":[],"generated_at":"2026-10-09T13:23:02Z","input_sha256":"1de86b825a73ff2ed5e6e697e797b24391746eeae3d5fc788b0e1c3bc34d4fc0","limitations":["stored_60m_slot_vs_actual_dive_interval","approximate_temporal_match","pci_is_subjective_not_velocity_or_safety","nulls_are_abstentions","no_recalculation_of_stored_forecast"],"official_snapshot":{"cutoff_at":"2026-10-08T12:00:00Z","forecast_sha256":"c08a0353f8220210d6d40d396a500a358bcc8849d7800ccb7054e84efd35bad9","manifest_sha256":"069976a243e8f2d74f12ee16a4b778865d6fbd2c9506ab70106799de4c1f06e2","persisted_at":"2026-10-08T03:07:36Z","run_id":"12ab5b5b-e1f0-59cc-88af-811903b2c95a","seal_sha256":"5ed1062b5b4b4b6859deae8d9d551ce50dc78a4e1e58303ba3ac0239b8b852bc","storage_commit":"681c6c2647c6797847fed5f217847034bd7baebc"},"rows":[{"absolute_error":0.008154685312528165,"actual":0.27,"day":"2026-10-09","global_baseline":0.28,"id":"17fcf831-2d71-423b-a3f4-b7b893512dcc","midpoint_offset_minutes":5.5,"model_version":"weighted-analog-v1.3","observation_end_at":"2026-10-09T04:58:00.000Z","observation_sha256":"02cfa174ba841dbb1570abe6dd41994c585bb2f356b219b0ff2d5e42c4f9f645","observation_start_at":"2026-10-09T04:13:00.000Z","pci":0.2781546853125282,"prediction_duration_minutes":60,"prediction_start_at":"2026-10-09T04:00:00+00:00","reason_codes":[],"revision":1,"site_baseline":0.24,"site_id":"lekuan-3","support":"very_low","temporal_match":"approximate_window","zone_id":null},{"absolute_error":0.019698447169814393,"actual":0.29,"day":"2026-10-09","global_baseline":0.28,"id":"2642b7fe-9d5f-449d-997a-7c0e95c8b632","midpoint_offset_minutes":6.0,"model_version":"weighted-analog-v1.3","observation_end_at":"2026-10-09T02:59:00.000Z","observation_sha256":"96e489aeb1386246e4c14e866339327bd7da0f8f35f61d9347080cee3256a500","observation_start_at":"2026-10-09T02:13:00.000Z","pci":0.3096984471698144,"prediction_duration_minutes":60,"prediction_start_at":"2026-10-09T02:00:00+00:00","reason_codes":[],"revision":1,"site_baseline":0.38,"site_id":"fukui","support":"very_low","temporal_match":"approximate_window","zone_id":null},{"absolute_error":0.010996231557716896,"actual":0.26,"day":"2026-10-09","global_baseline":0.28,"id":"fa22ffba-71f2-40df-a3e4-a026fe6d5750","midpoint_offset_minutes":11.0,"model_version":"weighted-analog-v1.3","observation_end_at":"2026-10-09T07:12:00.000Z","observation_sha256":"33feaa2960c849c6254fb9513964adbc1226495f539d073970402e2a78fb7dbb","observation_start_at":"2026-10-09T06:26:00.000Z","pci":0.2709962315577169,"prediction_duration_minutes":60,"prediction_start_at":"2026-10-09T06:30:00+00:00","reason_codes":[],"revision":1,"site_baseline":0.275,"site_id":"lekuan-2","support":"very_low","temporal_match":"approximate_window","zone_id":null}],"rule":"stored-slot-midpoint-15m-v1","schema_version":"1.0","source_data_commit":"2a9d1632330e5effa8a3fcdcb40240d425b04fae"}
