{"code_commit":"c84cb9a99036be44b36a0bc73417cb119371bedc","cohort_metrics":[{"metrics":{"abstention_count":3,"coverage":0.0,"global_baseline_large_error_rate":null,"global_baseline_mae":null,"large_error_rate":null,"large_error_threshold":null,"mae":null,"predicted_count":0,"predicted_days":0,"site_baseline_mae":null,"test_count":3},"observer_id":"bunaken-observer-01","rubric_version":"pci-overall-v1"}],"date_wita":"2026-10-01","excluded_observations":[],"generated_at":"2026-10-08T18:47:48Z","input_sha256":"f4d6d2c4b055465b3879341a6f9d59ad4fb3fc41e3f504b2083e001d160caa46","limitations":["stored_60m_slot_vs_actual_dive_interval","approximate_temporal_match","pci_is_subjective_not_velocity_or_safety","nulls_are_abstentions","no_recalculation_of_stored_forecast"],"official_snapshot":null,"rows":[{"absolute_error":null,"actual":0.18,"day":"2026-10-01","global_baseline":null,"id":"54160395-5eea-40b6-9d2b-8d80fc25810e","midpoint_offset_minutes":null,"model_version":null,"observation_end_at":"2026-10-01T06:54:00.000Z","observation_sha256":"5cd0773c2f2a3ab7d2a5fc62617a97e18e5d02eb48c7af2497d01d990a36a691","observation_start_at":"2026-10-01T06:02:00.000Z","pci":null,"prediction_duration_minutes":null,"prediction_start_at":null,"reason_codes":["official_seal_missing"],"revision":3,"site_baseline":null,"site_id":"lekuan-2","support":null,"temporal_match":null,"zone_id":null},{"absolute_error":null,"actual":0.65,"day":"2026-10-01","global_baseline":null,"id":"5515832a-0c46-473c-8fe3-aa5c353d3cd0","midpoint_offset_minutes":null,"model_version":null,"observation_end_at":"2026-10-01T02:22:00.000Z","observation_sha256":"367b4375fcd8915ed256d2591be6d86ab1d39b6fd9d09e7d468f75948de90b68","observation_start_at":"2026-10-01T01:41:00.000Z","pci":null,"prediction_duration_minutes":null,"prediction_start_at":null,"reason_codes":["official_seal_missing"],"revision":3,"site_baseline":null,"site_id":"rons-point","support":null,"temporal_match":null,"zone_id":null},{"absolute_error":null,"actual":0.18,"day":"2026-10-01","global_baseline":null,"id":"a5967819-0bb1-4a14-a048-8c52f70f0d68","midpoint_offset_minutes":null,"model_version":null,"observation_end_at":"2026-10-01T04:17:00.000Z","observation_sha256":"e5e0ecf1e3ced4fd992045255717beb8f1a3a53bd634577a1a154fd777d22b50","observation_start_at":"2026-10-01T03:26:00.000Z","pci":null,"prediction_duration_minutes":null,"prediction_start_at":null,"reason_codes":["official_seal_missing"],"revision":3,"site_baseline":null,"site_id":"celah-celah","support":null,"temporal_match":null,"zone_id":null}],"rule":"stored-slot-midpoint-15m-v1","schema_version":"1.0","source_data_commit":"8707b4cbadf94fc9b13f80eba8997574ac8289c0"}
