{"code_commit":"8075ef2edba0119c57901b3a880cb6e7989eb8f1","cohort_metrics":[{"metrics":{"abstention_count":3,"coverage":0.0,"global_baseline_large_error_rate":null,"global_baseline_mae":null,"large_error_rate":null,"large_error_threshold":null,"mae":null,"predicted_count":0,"predicted_days":0,"site_baseline_mae":null,"test_count":3},"observer_id":"bunaken-observer-01","rubric_version":"pci-overall-v1"}],"date_wita":"2026-10-05","excluded_observations":[],"generated_at":"2026-10-12T00:43:26Z","input_sha256":"1071fa05c846e90e42166d89bff2f9e28f4e412b3cefe5476f0b8dcd4a3fcf44","limitations":["stored_60m_slot_vs_actual_dive_interval","approximate_temporal_match","pci_is_subjective_not_velocity_or_safety","nulls_are_abstentions","no_recalculation_of_stored_forecast"],"official_snapshot":null,"rows":[{"absolute_error":null,"actual":0.3,"day":"2026-10-05","global_baseline":null,"id":"3b12bfbf-fa3f-4433-af9c-81b19efacb5a","midpoint_offset_minutes":null,"model_version":null,"observation_end_at":"2026-10-05T06:17:00.000Z","observation_sha256":"40ba55b2eab1a363870f1b090885b1096d03c496fc47177ad72a71e78e26f6ab","observation_start_at":"2026-10-05T05:37:00.000Z","pci":null,"prediction_duration_minutes":null,"prediction_start_at":null,"reason_codes":["official_seal_missing"],"revision":2,"site_baseline":null,"site_id":"muka-kampung","support":null,"temporal_match":null,"zone_id":null},{"absolute_error":null,"actual":0.28,"day":"2026-10-05","global_baseline":null,"id":"4a3b4146-637b-4445-9240-c60f080e87bb","midpoint_offset_minutes":null,"model_version":null,"observation_end_at":"2026-10-05T03:45:00.000Z","observation_sha256":"e87b24741592e5959cf682beb5e2f2a0402bb7b4a1b0c8f0c011e1c676a3ed50","observation_start_at":"2026-10-05T02:58:00.000Z","pci":null,"prediction_duration_minutes":null,"prediction_start_at":null,"reason_codes":["official_seal_missing"],"revision":1,"site_baseline":null,"site_id":"celah-celah","support":null,"temporal_match":null,"zone_id":null},{"absolute_error":null,"actual":0.28,"day":"2026-10-05","global_baseline":null,"id":"6624c416-65eb-4473-aa4f-08779159a093","midpoint_offset_minutes":null,"model_version":null,"observation_end_at":"2026-10-05T02:31:00.000Z","observation_sha256":"9e3bcef241d017e42da13c85767526582f6d56c66f2e7e5d6963605b320bcc63","observation_start_at":"2026-10-05T01:48:00.000Z","pci":null,"prediction_duration_minutes":null,"prediction_start_at":null,"reason_codes":["official_seal_missing"],"revision":1,"site_baseline":null,"site_id":"alung-banua","support":null,"temporal_match":null,"zone_id":null}],"rule":"stored-slot-midpoint-15m-v1","schema_version":"1.0","source_data_commit":"27fe3875497a5eeed2b090ac162c3843df76b9d0"}
