{"code_commit":"5653fe2ec05a06f1ef2d3f45e22ef05dfc5978ca","cohort_metrics":[{"metrics":{"abstention_count":1,"coverage":0.6666666666666666,"global_baseline_count":2,"global_baseline_large_error_rate":null,"global_baseline_mae":0.06499999999999997,"large_error_rate":null,"large_error_threshold":null,"mae":0.044308607574932546,"predicted_count":2,"predicted_days":1,"site_baseline_count":2,"site_baseline_mae":0.01999999999999999,"test_count":3},"observer_id":"bunaken-observer-01","rubric_version":"pci-overall-v1"}],"date_wita":"2026-10-24","excluded_observations":[],"generated_at":"2026-10-24T19:10:00Z","input_sha256":"e604509b8376ab0056ed310c23c6b0ded3a1148cde92268cb425bbf285e88b8d","limitations":["stored_60m_slot_vs_actual_dive_interval","approximate_temporal_match","pci_is_subjective_not_velocity_or_safety","nulls_are_abstentions","no_recalculation_of_stored_forecast"],"official_snapshot":{"cutoff_at":"2026-10-23T12:00:00Z","forecast_sha256":"50eab6690dad2582ab991f5107254953a3c0fe8ac9be81ed5dc8ae790ab8357b","manifest_sha256":"c71a999c62bb91ff9a67668df29d543e55e2280cee9fe026f666c384fc7be326","persisted_at":"2026-10-23T11:38:08Z","run_id":"42db99da-fcfd-52b0-b6e7-4bdcd9dbf7bf","seal_sha256":"d92c7c2446099c5d9d296cacf74fb53048b77c89d376a11a9b310d42228615e6","storage_commit":"03857eb4986d2731bfb7fedeb3c1d0b8c7dcf335"},"rows":[{"absolute_error":0.06700483214713687,"actual":0.41,"day":"2026-10-24","global_baseline":0.29,"id":"04df92cd-ec84-4d8f-a80d-38ff0169f988","midpoint_offset_minutes":12.5,"model_version":"weighted-analog-v1.3","observation_end_at":"2026-10-24T06:35:00.000Z","observation_sha256":"7675e834e8461f86dedcd38b243757cc63e0c95a95d497e2d69406d3698601fd","observation_start_at":"2026-10-24T05:50:00.000Z","pci":0.3429951678528631,"prediction_duration_minutes":60,"prediction_start_at":"2026-10-24T05:30:00+00:00","reason_codes":[],"revision":1,"site_baseline":0.37,"site_id":"lekuan-1","support":"very_low","temporal_match":"approximate_window","zone_id":null},{"absolute_error":0.02161238300272822,"actual":0.28,"day":"2026-10-24","global_baseline":0.29,"id":"132a2e5a-559c-4e3c-ad04-7e6bd767c64f","midpoint_offset_minutes":12.0,"model_version":"weighted-analog-v1.3","observation_end_at":"2026-10-24T04:35:00.000Z","observation_sha256":"68d2f9413b877bb014e7c392a40477d62532def6aa39e60f0db4bc5ae8e65e16","observation_start_at":"2026-10-24T03:49:00.000Z","pci":0.30161238300272825,"prediction_duration_minutes":60,"prediction_start_at":"2026-10-24T03:30:00+00:00","reason_codes":[],"revision":1,"site_baseline":0.28,"site_id":"alung-banua","support":"very_low","temporal_match":"approximate_window","zone_id":null},{"absolute_error":null,"actual":0.29,"day":"2026-10-24","global_baseline":0.29,"id":"c8cf90a2-8c75-481c-b755-11fd754b908a","midpoint_offset_minutes":12.0,"model_version":"weighted-analog-v1.3","observation_end_at":"2026-10-24T02:35:00.000Z","observation_sha256":"08c948d1b10f6aac34ba70cb78def8b9b8fa47924c786f03131db933d99e90d4","observation_start_at":"2026-10-24T01:49:00.000Z","pci":null,"prediction_duration_minutes":60,"prediction_start_at":"2026-10-24T01:30:00+00:00","reason_codes":["missing_same_site"],"revision":1,"site_baseline":null,"site_id":"raymonds-point","support":"insufficient","temporal_match":"approximate_window","zone_id":null}],"rule":"stored-slot-midpoint-15m-v1","schema_version":"1.0","source_data_commit":"baa948cac7d018b87f0a85291ed87755be4aa821"}
