{"code_commit":"8075ef2edba0119c57901b3a880cb6e7989eb8f1","cohort_metrics":[{"metrics":{"abstention_count":3,"coverage":0.0,"global_baseline_large_error_rate":null,"global_baseline_mae":null,"large_error_rate":null,"large_error_threshold":null,"mae":null,"predicted_count":0,"predicted_days":0,"site_baseline_mae":null,"test_count":3},"observer_id":"bunaken-observer-01","rubric_version":"pci-overall-v1"}],"date_wita":"2026-10-04","excluded_observations":[],"generated_at":"2026-10-12T00:43:26Z","input_sha256":"900afe389d7028bb4bcc0b66f52b2a4834157087a9fed04bca3fe2fe485105c9","limitations":["stored_60m_slot_vs_actual_dive_interval","approximate_temporal_match","pci_is_subjective_not_velocity_or_safety","nulls_are_abstentions","no_recalculation_of_stored_forecast"],"official_snapshot":null,"rows":[{"absolute_error":null,"actual":0.4,"day":"2026-10-04","global_baseline":null,"id":"21a4ff35-5312-4cd2-bf6b-7e3d5fa08038","midpoint_offset_minutes":null,"model_version":null,"observation_end_at":"2026-10-04T02:20:00.000Z","observation_sha256":"01055738aa885e7e0e484fb4dd5fa9acdc2d85922b42a23799aced543bd5c043","observation_start_at":"2026-10-04T01:41:00.000Z","pci":null,"prediction_duration_minutes":null,"prediction_start_at":null,"reason_codes":["official_seal_missing"],"revision":3,"site_baseline":null,"site_id":"fukui","support":null,"temporal_match":null,"zone_id":null},{"absolute_error":null,"actual":0.31,"day":"2026-10-04","global_baseline":null,"id":"2f643c18-3312-4e76-8f08-fe0b91d6d4e8","midpoint_offset_minutes":null,"model_version":null,"observation_end_at":"2026-10-04T06:35:00.000Z","observation_sha256":"7acbe4abfd9f0fe819dc5293d1334f80814febce19bfa4a08224d57e5701eb47","observation_start_at":"2026-10-04T05:48:00.000Z","pci":null,"prediction_duration_minutes":null,"prediction_start_at":null,"reason_codes":["official_seal_missing"],"revision":3,"site_baseline":null,"site_id":"lekuan-2","support":null,"temporal_match":null,"zone_id":null},{"absolute_error":null,"actual":0.23,"day":"2026-10-04","global_baseline":null,"id":"b4d754d5-dd01-46ed-a1b6-f4c4813887cf","midpoint_offset_minutes":null,"model_version":null,"observation_end_at":"2026-10-04T04:13:00.000Z","observation_sha256":"677c48a9bf6645a5f5466c7fe5cb21ae499ffcdc64abdb0b018013d18f8ca93d","observation_start_at":"2026-10-04T03:26:00.000Z","pci":null,"prediction_duration_minutes":null,"prediction_start_at":null,"reason_codes":["official_seal_missing"],"revision":3,"site_baseline":null,"site_id":"lekuan-3","support":null,"temporal_match":null,"zone_id":null}],"rule":"stored-slot-midpoint-15m-v1","schema_version":"1.0","source_data_commit":"27fe3875497a5eeed2b090ac162c3843df76b9d0"}
