{"code_commit":"8075ef2edba0119c57901b3a880cb6e7989eb8f1","cohort_metrics":[{"metrics":{"abstention_count":0,"coverage":1.0,"global_baseline_count":1,"global_baseline_large_error_rate":null,"global_baseline_mae":0.09999999999999998,"large_error_rate":null,"large_error_threshold":null,"mae":0.07120807990198408,"predicted_count":1,"predicted_days":1,"site_baseline_count":1,"site_baseline_mae":0.08000000000000002,"test_count":1},"observer_id":"bunaken-observer-01","rubric_version":"pci-overall-v1"}],"date_wita":"2026-10-16","excluded_observations":[],"generated_at":"2026-10-16T03:20:59Z","input_sha256":"bd0ac964ef97f2addc67e5800b2f6277f5e9c439678c1856ce7f993e2fc980b4","limitations":["stored_60m_slot_vs_actual_dive_interval","approximate_temporal_match","pci_is_subjective_not_velocity_or_safety","nulls_are_abstentions","no_recalculation_of_stored_forecast"],"official_snapshot":{"cutoff_at":"2026-10-15T12:00:00Z","forecast_sha256":"66408e36628ca4aafd77f61e99394ff9c04b35a1eaa7a8518d932d2b7ce6c5d6","manifest_sha256":"64d22e392b07b6f6604e8549d43bdf0bc23a3014214edc80650c1a59a3bc8a69","persisted_at":"2026-10-15T08:29:02Z","run_id":"78e54d44-da2c-5391-8fc1-b35703f064e8","seal_sha256":"f30fef03d18398d9e43fe313bbee45e9b2de0de5ee8e4229f73a22535fb01b1d","storage_commit":"858c9302d834c1ef09934ab2c8a3295a908d6a77"},"rows":[{"absolute_error":0.07120807990198408,"actual":0.38,"day":"2026-10-16","global_baseline":0.28,"id":"452afc40-4942-4349-b9fa-41e251e0165f","midpoint_offset_minutes":2.5,"model_version":"weighted-analog-v1.3","observation_end_at":"2026-10-16T02:20:00.000Z","observation_sha256":"00d43c9e0d83a085fc0b23269696a744a8b64c8b62c129a5cdcca0842f8e833e","observation_start_at":"2026-10-16T01:35:00.000Z","pci":0.3087919200980159,"prediction_duration_minutes":60,"prediction_start_at":"2026-10-16T01:30:00+00:00","reason_codes":[],"revision":1,"site_baseline":0.3,"site_id":"fukui","support":"very_low","temporal_match":"approximate_window","zone_id":null}],"rule":"stored-slot-midpoint-15m-v1","schema_version":"1.0","source_data_commit":"db76a2a98fe22c441857791d64d52713b59dc21a"}
