{"code_commit":"8075ef2edba0119c57901b3a880cb6e7989eb8f1","cohort_metrics":[{"metrics":{"abstention_count":0,"coverage":1.0,"global_baseline_count":1,"global_baseline_large_error_rate":null,"global_baseline_mae":0.08999999999999997,"large_error_rate":null,"large_error_threshold":null,"mae":0.0693406870500341,"predicted_count":1,"predicted_days":1,"site_baseline_count":1,"site_baseline_mae":0.05499999999999999,"test_count":1},"observer_id":"bunaken-observer-01","rubric_version":"pci-overall-v1"}],"date_wita":"2026-10-17","excluded_observations":[],"generated_at":"2026-10-17T04:19:49Z","input_sha256":"95488d135bce9b6482a5916a95fad6b58a1cab47f6e12779088d940b38c75362","limitations":["stored_60m_slot_vs_actual_dive_interval","approximate_temporal_match","pci_is_subjective_not_velocity_or_safety","nulls_are_abstentions","no_recalculation_of_stored_forecast"],"official_snapshot":{"cutoff_at":"2026-10-16T12:00:00Z","forecast_sha256":"22f85a8cfc2c3fca94c89f376daca3dad07fd56609111081be60ef2d167020cf","manifest_sha256":"76dce9fbf5a6bfe23a5eaa2ae7cc77664075d03020cf14558f1ae33104990657","persisted_at":"2026-10-16T08:38:56Z","run_id":"8a071fcd-24a3-5856-88a6-ca070c4d89a1","seal_sha256":"f736a21c2b44544f29f1833c06ee42bb2fb3341e2312325272480cf15cea70e4","storage_commit":"fcd9d610f5f17e5543a958fb727b5b0081a6f44a"},"rows":[{"absolute_error":0.0693406870500341,"actual":0.37,"day":"2026-10-17","global_baseline":0.28,"id":"99d29517-9da6-4488-9e4b-237de732e28f","midpoint_offset_minutes":14.0,"model_version":"weighted-analog-v1.3","observation_end_at":"2026-10-17T02:08:00.000Z","observation_sha256":"14fbdf722a2098059283b391547f0543994db90a58f80aa6a7c1857d019ac6e9","observation_start_at":"2026-10-17T01:20:00.000Z","pci":0.3006593129499659,"prediction_duration_minutes":60,"prediction_start_at":"2026-10-17T01:00:00+00:00","reason_codes":[],"revision":1,"site_baseline":0.315,"site_id":"muka-kampung","support":"very_low","temporal_match":"approximate_window","zone_id":null}],"rule":"stored-slot-midpoint-15m-v1","schema_version":"1.0","source_data_commit":"033e7929acd7915254cda76069af6fd5ef1c81d0"}
