{"code_commit":"c8d1de0667efef1be9d31c052e7bb59b6cfdaa1c","cohort_metrics":[{"metrics":{"abstention_count":3,"coverage":0.0,"global_baseline_large_error_rate":null,"global_baseline_mae":null,"large_error_rate":null,"large_error_threshold":null,"mae":null,"predicted_count":0,"predicted_days":0,"site_baseline_mae":null,"test_count":3},"observer_id":"bunaken-observer-01","rubric_version":"pci-overall-v1"}],"date_wita":"2026-10-02","excluded_observations":[],"generated_at":"2026-10-08T18:36:25Z","input_sha256":"02cc5106e319d4aedb708673f7d7950a7f96555c0886b6936cd2b5688447e169","limitations":["stored_60m_slot_vs_actual_dive_interval","approximate_temporal_match","pci_is_subjective_not_velocity_or_safety","nulls_are_abstentions","no_recalculation_of_stored_forecast"],"official_snapshot":null,"rows":[{"absolute_error":null,"actual":0.27,"day":"2026-10-02","global_baseline":null,"id":"50266612-6877-4459-9d26-ecc9052a34d4","midpoint_offset_minutes":null,"model_version":null,"observation_end_at":"2026-10-02T08:05:00.000Z","observation_sha256":"3c9ac65a7a84cf213d5811f12b321db73df6a5ebf1e1a96ec6605f37706f6cd9","observation_start_at":"2026-10-02T07:14:00.000Z","pci":null,"prediction_duration_minutes":null,"prediction_start_at":null,"reason_codes":["official_seal_missing"],"revision":3,"site_baseline":null,"site_id":"lekuan-2","support":null,"temporal_match":null,"zone_id":null},{"absolute_error":null,"actual":0.25,"day":"2026-10-02","global_baseline":null,"id":"964eafd7-7761-4f4f-9248-4d028fede087","midpoint_offset_minutes":null,"model_version":null,"observation_end_at":"2026-10-02T05:08:00.000Z","observation_sha256":"9267c5ec961ba8d23f9ede2fba3c55b7b9e66d81a0fa9c67298588f412d5d493","observation_start_at":"2026-10-02T04:22:00.000Z","pci":null,"prediction_duration_minutes":null,"prediction_start_at":null,"reason_codes":["official_seal_missing"],"revision":3,"site_baseline":null,"site_id":"lekuan-3","support":null,"temporal_match":null,"zone_id":null},{"absolute_error":null,"actual":0.38,"day":"2026-10-02","global_baseline":null,"id":"b7433dac-f2c4-4f26-9fd3-b5895ff73f3f","midpoint_offset_minutes":null,"model_version":null,"observation_end_at":"2026-10-02T03:16:00.000Z","observation_sha256":"fa6cb39ac646e1eefcf66ab400868ba135bec47ee95d17c14d7ed0e2a0e0e3e4","observation_start_at":"2026-10-02T02:27:00.000Z","pci":null,"prediction_duration_minutes":null,"prediction_start_at":null,"reason_codes":["official_seal_missing"],"revision":3,"site_baseline":null,"site_id":"fukui","support":null,"temporal_match":null,"zone_id":null}],"rule":"stored-slot-midpoint-15m-v1","schema_version":"1.0","source_data_commit":"ed0d2a5af47e4baf33954024f13ace665de7e180"}
