{"code_commit":"c8d1de0667efef1be9d31c052e7bb59b6cfdaa1c","cohort_metrics":[{"metrics":{"abstention_count":3,"coverage":0.0,"global_baseline_large_error_rate":null,"global_baseline_mae":null,"large_error_rate":null,"large_error_threshold":null,"mae":null,"predicted_count":0,"predicted_days":0,"site_baseline_mae":null,"test_count":3},"observer_id":"bunaken-observer-01","rubric_version":"pci-overall-v1"}],"date_wita":"2026-10-06","excluded_observations":[],"generated_at":"2026-10-08T18:36:25Z","input_sha256":"d0caf567eeeab4ada8c6cb7ffeb441e9ab989695a507adce7a141c2461451c4f","limitations":["stored_60m_slot_vs_actual_dive_interval","approximate_temporal_match","pci_is_subjective_not_velocity_or_safety","nulls_are_abstentions","no_recalculation_of_stored_forecast"],"official_snapshot":null,"rows":[{"absolute_error":null,"actual":0.23,"day":"2026-10-06","global_baseline":null,"id":"5854a3e3-c14f-4376-bfbc-458cde44b6a9","midpoint_offset_minutes":null,"model_version":null,"observation_end_at":"2026-10-06T02:41:00.000Z","observation_sha256":"f4b5d8cb4373926821a6510ff1da29e9b35bda79833af09e76c8a46e521fe3d0","observation_start_at":"2026-10-06T01:41:00.000Z","pci":null,"prediction_duration_minutes":null,"prediction_start_at":null,"reason_codes":["official_seal_missing"],"revision":1,"site_baseline":null,"site_id":"fukui","support":null,"temporal_match":null,"zone_id":null},{"absolute_error":null,"actual":0.28,"day":"2026-10-06","global_baseline":null,"id":"5e6b5975-877f-4a20-9957-0cf57679da37","midpoint_offset_minutes":null,"model_version":null,"observation_end_at":"2026-10-06T06:38:00.000Z","observation_sha256":"c76154b50810e9f9db27edd2642b723241c613ac48f0d4df72dc5d48cf01b5f5","observation_start_at":"2026-10-06T05:38:00.000Z","pci":null,"prediction_duration_minutes":null,"prediction_start_at":null,"reason_codes":["official_seal_missing"],"revision":1,"site_baseline":null,"site_id":"lekuan-2","support":null,"temporal_match":null,"zone_id":null},{"absolute_error":null,"actual":0.21,"day":"2026-10-06","global_baseline":null,"id":"e4c98c46-38d6-4d6c-b602-a6c87bee37aa","midpoint_offset_minutes":null,"model_version":null,"observation_end_at":"2026-10-06T04:26:00.000Z","observation_sha256":"f6504c4787c89eb4fee5f8e0c2290fd86da0a2ee5088edfe183508f834edde90","observation_start_at":"2026-10-06T03:26:00.000Z","pci":null,"prediction_duration_minutes":null,"prediction_start_at":null,"reason_codes":["official_seal_missing"],"revision":1,"site_baseline":null,"site_id":"celah-celah","support":null,"temporal_match":null,"zone_id":null}],"rule":"stored-slot-midpoint-15m-v1","schema_version":"1.0","source_data_commit":"ed0d2a5af47e4baf33954024f13ace665de7e180"}
