{"code_commit":"8075ef2edba0119c57901b3a880cb6e7989eb8f1","cohort_metrics":[{"metrics":{"abstention_count":3,"coverage":0.0,"global_baseline_large_error_rate":null,"global_baseline_mae":null,"large_error_rate":null,"large_error_threshold":null,"mae":null,"predicted_count":0,"predicted_days":0,"site_baseline_mae":null,"test_count":3},"observer_id":"bunaken-observer-01","rubric_version":"pci-overall-v1"}],"date_wita":"2026-09-29","excluded_observations":[],"generated_at":"2026-10-12T00:43:26Z","input_sha256":"a6865008283441c2ad5f2b24fd0a0962d9e8e2983ce1b4a7b8b67cb266043222","limitations":["stored_60m_slot_vs_actual_dive_interval","approximate_temporal_match","pci_is_subjective_not_velocity_or_safety","nulls_are_abstentions","no_recalculation_of_stored_forecast"],"official_snapshot":null,"rows":[{"absolute_error":null,"actual":0.46,"day":"2026-09-29","global_baseline":null,"id":"447ca9c7-b8ba-4f6c-9c51-c597c98b943a","midpoint_offset_minutes":null,"model_version":null,"observation_end_at":"2026-09-29T02:02:00.000Z","observation_sha256":"2c0b9d024f51df9a8e4f24818d51f7ab06c4746cf5df87bebd19e4a9593d075c","observation_start_at":"2026-09-29T01:13:00.000Z","pci":null,"prediction_duration_minutes":null,"prediction_start_at":null,"reason_codes":["official_seal_missing"],"revision":3,"site_baseline":null,"site_id":"mandolin","support":null,"temporal_match":null,"zone_id":null},{"absolute_error":null,"actual":0.29,"day":"2026-09-29","global_baseline":null,"id":"77eb8b8d-ffc4-44c4-9c5f-dece4d4f001d","midpoint_offset_minutes":null,"model_version":null,"observation_end_at":"2026-09-29T05:57:00.000Z","observation_sha256":"7c4a2ea4efa5e6952e3b79a19e327be65c1aea50c5f5b0e1cd7581cba0175419","observation_start_at":"2026-09-29T05:06:00.000Z","pci":null,"prediction_duration_minutes":null,"prediction_start_at":null,"reason_codes":["official_seal_missing"],"revision":3,"site_baseline":null,"site_id":"muka-kampung","support":null,"temporal_match":null,"zone_id":null},{"absolute_error":null,"actual":0.33,"day":"2026-09-29","global_baseline":null,"id":"c50150e1-ce1d-46d6-adc4-457097924519","midpoint_offset_minutes":null,"model_version":null,"observation_end_at":"2026-09-29T03:56:00.000Z","observation_sha256":"857721919106bba3e130f626714e36c85fcbbd0d9990b888b1a8e55b7a8b8c38","observation_start_at":"2026-09-29T03:10:00.000Z","pci":null,"prediction_duration_minutes":null,"prediction_start_at":null,"reason_codes":["official_seal_missing"],"revision":3,"site_baseline":null,"site_id":"alung-banua","support":null,"temporal_match":null,"zone_id":null}],"rule":"stored-slot-midpoint-15m-v1","schema_version":"1.0","source_data_commit":"27fe3875497a5eeed2b090ac162c3843df76b9d0"}
