{"code_commit":"8075ef2edba0119c57901b3a880cb6e7989eb8f1","cohort_metrics":[{"metrics":{"abstention_count":0,"coverage":1.0,"global_baseline_count":1,"global_baseline_large_error_rate":null,"global_baseline_mae":0.019999999999999962,"large_error_rate":null,"large_error_threshold":null,"mae":0.009825378603337098,"predicted_count":1,"predicted_days":1,"site_baseline_count":1,"site_baseline_mae":0.034999999999999976,"test_count":1},"observer_id":"bunaken-observer-01","rubric_version":"pci-overall-v1"}],"date_wita":"2026-10-13","excluded_observations":[],"generated_at":"2026-10-13T04:53:35Z","input_sha256":"da70b8777f922e2ab34caff2913c568e6b4505b58afe8effabe6cd3c80eeecc3","limitations":["stored_60m_slot_vs_actual_dive_interval","approximate_temporal_match","pci_is_subjective_not_velocity_or_safety","nulls_are_abstentions","no_recalculation_of_stored_forecast"],"official_snapshot":{"cutoff_at":"2026-10-12T12:00:00Z","forecast_sha256":"43a16a8025c459f50e5cccc4d1d7c04e645e1ab8f60eb3bc9b81cce56e7bc7bc","manifest_sha256":"091e363bb62350950845d7a51b9cb1f0fd8694a5d87149e95570406bafd91a0c","persisted_at":"2026-10-12T07:55:10Z","run_id":"eb392273-1355-5726-978e-f6878ee196f3","seal_sha256":"56d57ea4b5a63010b5126e6dde598e3cd26eecd292aeb09f94607663580b59a4","storage_commit":"6f831793c143f25f56b7c923b38f4bf2500b831f"},"rows":[{"absolute_error":0.009825378603337098,"actual":0.3,"day":"2026-10-13","global_baseline":0.28,"id":"4b41dd99-184f-48c4-a0c3-8e421acbf0df","midpoint_offset_minutes":14.5,"model_version":"weighted-analog-v1.3","observation_end_at":"2026-10-13T02:43:00.000Z","observation_sha256":"a119e5a834dbfeef2be0e6c0ce07e8815f555c2f9552af7cfb9cf9a16268e41f","observation_start_at":"2026-10-13T01:48:00.000Z","pci":0.3098253786033371,"prediction_duration_minutes":60,"prediction_start_at":"2026-10-13T02:00:00+00:00","reason_codes":[],"revision":1,"site_baseline":0.33499999999999996,"site_id":"fukui","support":"very_low","temporal_match":"approximate_window","zone_id":null}],"rule":"stored-slot-midpoint-15m-v1","schema_version":"1.0","source_data_commit":"b602872af141bc177174d7d4b3fc933beba7e5c4"}
