{"code_commit":"8075ef2edba0119c57901b3a880cb6e7989eb8f1","cohort_metrics":[{"metrics":{"abstention_count":0,"coverage":1.0,"global_baseline_count":1,"global_baseline_large_error_rate":null,"global_baseline_mae":0.009999999999999953,"large_error_rate":null,"large_error_threshold":null,"mae":0.014454834002248562,"predicted_count":1,"predicted_days":1,"site_baseline_count":1,"site_baseline_mae":0.010000000000000009,"test_count":1},"observer_id":"bunaken-observer-01","rubric_version":"pci-overall-v1"}],"date_wita":"2026-10-20","excluded_observations":[],"generated_at":"2026-10-20T05:13:40Z","input_sha256":"44591615db34668d264fe5e49d919b8d9f0ec2cb856113d223d13e10355b2872","limitations":["stored_60m_slot_vs_actual_dive_interval","approximate_temporal_match","pci_is_subjective_not_velocity_or_safety","nulls_are_abstentions","no_recalculation_of_stored_forecast"],"official_snapshot":{"cutoff_at":"2026-10-19T12:00:00Z","forecast_sha256":"32cee787cbfb9cccb715fd1a407ffcb8422e4602b347106960a02a75387828eb","manifest_sha256":"82a190d40a0d5994f2051fa42aa4a89706a880ae1da47175692d6f31e01a5e2d","persisted_at":"2026-10-19T11:54:23Z","run_id":"3481fac1-fd3d-551b-af18-2ee8540c8847","seal_sha256":"43f75dfaf8d8a40168a4d7814a0142a2fe5cfd063b4906cfc938c883783336d6","storage_commit":"5d1a7abbf689127d4f85132ed54fcd4e9c4e8f8e"},"rows":[{"absolute_error":0.014454834002248562,"actual":0.28,"day":"2026-10-20","global_baseline":0.29,"id":"4f978452-5ba5-4490-b78d-ee8cd784b7ad","midpoint_offset_minutes":0.5,"model_version":"weighted-analog-v1.3","observation_end_at":"2026-10-20T03:23:00.000Z","observation_sha256":"f7638f2ba168d46c391bc4c06bec75362baba81a3bf4803f9084a38160247f81","observation_start_at":"2026-10-20T02:38:00.000Z","pci":0.2944548340022486,"prediction_duration_minutes":60,"prediction_start_at":"2026-10-20T02:30:00+00:00","reason_codes":[],"revision":1,"site_baseline":0.27,"site_id":"lekuan-3","support":"very_low","temporal_match":"approximate_window","zone_id":null}],"rule":"stored-slot-midpoint-15m-v1","schema_version":"1.0","source_data_commit":"1b37469cf58818fa92a52c9593f27f1fd2895d4b"}
