{"code_commit":"8075ef2edba0119c57901b3a880cb6e7989eb8f1","cohort_metrics":[{"metrics":{"abstention_count":0,"coverage":1.0,"global_baseline_count":2,"global_baseline_large_error_rate":null,"global_baseline_mae":0.024999999999999994,"large_error_rate":null,"large_error_threshold":null,"mae":0.04419036508616733,"predicted_count":2,"predicted_days":1,"site_baseline_count":2,"site_baseline_mae":0.05499999999999999,"test_count":2},"observer_id":"bunaken-observer-01","rubric_version":"pci-overall-v1"}],"date_wita":"2026-10-21","excluded_observations":[],"generated_at":"2026-10-21T06:30:58Z","input_sha256":"bd47f5fa62d3ea99f23bef5d68554eda636d0431d7a851cdb6f8444c5f4c23be","limitations":["stored_60m_slot_vs_actual_dive_interval","approximate_temporal_match","pci_is_subjective_not_velocity_or_safety","nulls_are_abstentions","no_recalculation_of_stored_forecast"],"official_snapshot":{"cutoff_at":"2026-10-20T12:00:00Z","forecast_sha256":"dd0722344c00e0bf94331ec4786fa12919a9a7cee495a1fd8c3147285dabd667","manifest_sha256":"3812aed95a398fbfc0168c801c1606590eeea0c2ca6e17d21aa64ce64651b69d","persisted_at":"2026-10-20T08:38:57Z","run_id":"a5ff1d84-c95b-5bab-a0bb-2599bde05faf","seal_sha256":"b140caa474866ea41cc2bdb8f442854ae03e43105bab76017dc0121f467106c5","storage_commit":"b27deeb2ad80ba2a44f7f9531ff4960b06d1a8bf"},"rows":[{"absolute_error":0.08076081581203681,"actual":0.25,"day":"2026-10-21","global_baseline":0.28500000000000003,"id":"5f0d681f-033b-48f8-80de-a288f11cfa77","midpoint_offset_minutes":14.0,"model_version":"weighted-analog-v1.3","observation_end_at":"2026-10-21T02:13:00.000Z","observation_sha256":"d20a4c85ac2e0ac6a3eb0f4ba1496f7c072879fb6d33b3c569af2b3561a75860","observation_start_at":"2026-10-21T01:19:00.000Z","pci":0.3307608158120368,"prediction_duration_minutes":60,"prediction_start_at":"2026-10-21T01:30:00+00:00","reason_codes":[],"revision":1,"site_baseline":0.34,"site_id":"fukui","support":"very_low","temporal_match":"approximate_window","zone_id":null},{"absolute_error":0.0076199143602978525,"actual":0.3,"day":"2026-10-21","global_baseline":0.28500000000000003,"id":"b5a666e0-b36b-40b1-a6ce-3a6ddd82e450","midpoint_offset_minutes":9.0,"model_version":"weighted-analog-v1.3","observation_end_at":"2026-10-21T04:16:00.000Z","observation_sha256":"7c365d9a048b6b63271026dc0add3cad4de610a629c20f920d96149e4d451337","observation_start_at":"2026-10-21T03:26:00.000Z","pci":0.30761991436029784,"prediction_duration_minutes":60,"prediction_start_at":"2026-10-21T03:30:00+00:00","reason_codes":[],"revision":1,"site_baseline":0.28,"site_id":"alung-banua","support":"very_low","temporal_match":"approximate_window","zone_id":null}],"rule":"stored-slot-midpoint-15m-v1","schema_version":"1.0","source_data_commit":"143d094057a64681ea6cd92fc59bdc12820bd0c6"}
