{"code_commit":"c8d1de0667efef1be9d31c052e7bb59b6cfdaa1c","cohort_metrics":[{"metrics":{"abstention_count":1,"coverage":0.0,"global_baseline_large_error_rate":null,"global_baseline_mae":null,"large_error_rate":null,"large_error_threshold":null,"mae":null,"predicted_count":0,"predicted_days":0,"site_baseline_mae":null,"test_count":1},"observer_id":"bunaken-observer-01","rubric_version":"pci-overall-v1"}],"date_wita":"2026-09-19","excluded_observations":[],"generated_at":"2026-10-08T18:36:25Z","input_sha256":"54b6b6ad7e97a331131901131a9a4dbeb6b697e569bf6e91b1135f988d48cbb5","limitations":["stored_60m_slot_vs_actual_dive_interval","approximate_temporal_match","pci_is_subjective_not_velocity_or_safety","nulls_are_abstentions","no_recalculation_of_stored_forecast"],"official_snapshot":null,"rows":[{"absolute_error":null,"actual":0.7,"day":"2026-09-19","global_baseline":null,"id":"9245af0d-6dd1-4f3e-a156-7e382f76bbda","midpoint_offset_minutes":null,"model_version":null,"observation_end_at":null,"observation_sha256":"91948aae41fff62e8551f249486e30e0c9770832d7bf2fb03eeefb1c8cfb034f","observation_start_at":"2026-09-19T03:23:00.000Z","pci":null,"prediction_duration_minutes":null,"prediction_start_at":null,"reason_codes":["official_seal_missing"],"revision":4,"site_baseline":null,"site_id":"mandolin","support":null,"temporal_match":null,"zone_id":null}],"rule":"stored-slot-midpoint-15m-v1","schema_version":"1.0","source_data_commit":"ed0d2a5af47e4baf33954024f13ace665de7e180"}
