{"code_commit":"c84cb9a99036be44b36a0bc73417cb119371bedc","cohort_metrics":[{"metrics":{"abstention_count":2,"coverage":0.0,"global_baseline_large_error_rate":null,"global_baseline_mae":null,"large_error_rate":null,"large_error_threshold":null,"mae":null,"predicted_count":0,"predicted_days":0,"site_baseline_mae":null,"test_count":2},"observer_id":"bunaken-observer-01","rubric_version":"pci-overall-v1"}],"date_wita":"2026-10-07","excluded_observations":[],"generated_at":"2026-10-08T18:47:48Z","input_sha256":"d5c572556c5fb8b6066d94935ce59739790353f7d0e3affda0ca3e63d1c543ed","limitations":["stored_60m_slot_vs_actual_dive_interval","approximate_temporal_match","pci_is_subjective_not_velocity_or_safety","nulls_are_abstentions","no_recalculation_of_stored_forecast"],"official_snapshot":null,"rows":[{"absolute_error":null,"actual":0.46,"day":"2026-10-07","global_baseline":null,"id":"7975ace8-333e-46d6-8e63-b4c3a0dc03c8","midpoint_offset_minutes":null,"model_version":null,"observation_end_at":"2026-10-07T05:00:00.000Z","observation_sha256":"d7d25f599b75084da971f27cc5ecd5c452545b5574fecb4c8f90af375b22eeeb","observation_start_at":"2026-10-07T04:04:00.000Z","pci":null,"prediction_duration_minutes":null,"prediction_start_at":null,"reason_codes":["official_seal_missing"],"revision":1,"site_baseline":null,"site_id":"rons-point","support":null,"temporal_match":null,"zone_id":null},{"absolute_error":null,"actual":0.27,"day":"2026-10-07","global_baseline":null,"id":"b6518f69-44fc-42cc-85ba-caffaec23095","midpoint_offset_minutes":null,"model_version":null,"observation_end_at":"2026-10-07T07:27:00.000Z","observation_sha256":"b24d2025c15e30293ba8bcd3d7a8285955073411aa6e00f9872de5f9fe937b9e","observation_start_at":"2026-10-07T06:29:00.000Z","pci":null,"prediction_duration_minutes":null,"prediction_start_at":null,"reason_codes":["official_seal_missing"],"revision":1,"site_baseline":null,"site_id":"lekuan-1","support":null,"temporal_match":null,"zone_id":null}],"rule":"stored-slot-midpoint-15m-v1","schema_version":"1.0","source_data_commit":"8707b4cbadf94fc9b13f80eba8997574ac8289c0"}
